{
	"$schema": "http://json-schema.org/draft-07/schema#",
	"$id": "https://dforge.dev/schemas/folders.schema.json",
	"title": "dForge Folders",
	"description": "Folder tree for a dForge module. The file IS the root folder (not a map keyed by code). Sub-folders live under `children`, keyed by folder code.",
	"$ref": "#/$defs/folder",
	"$defs": {
		"folder": {
			"type": "object",
			"properties": {
				"label": {
					"type": "string",
					"description": "Folder display name"
				},
				"description": {
					"type": "string",
					"description": "Optional description text (shown in breadcrumb / header area)"
				},
				"parentCode": {
					"type": ["string", "null"],
					"description": "Parent folder code. Usually omitted: nested folders go under `children` of their parent. Only used by sparse-tree imports."
				},
				"folderPath": {
					"type": "string",
					"description": "URL-friendly folder path override"
				},
				"color": {
					"type": "string",
					"description": "Folder accent color (hex, e.g. '#2196F3')"
				},
				"icon": {
					"type": "string",
					"description": "Bootstrap icon class (e.g. 'bi-folder')"
				},
				"inheritSecurity": {
					"type": "boolean",
					"description": "Whether to inherit security rights from the parent folder. Default: true."
				},
				"entities": {
					"type": "object",
					"description": "Entity code → folder-entity binding (which view to show, quick-add, row-level filter).",
					"additionalProperties": {
						"$ref": "#/$defs/folderEntity"
					}
				},
				"children": {
					"type": "object",
					"description": "Nested folders keyed by sub-folder code. Recursive — children can have their own children.",
					"additionalProperties": {
						"$ref": "#/$defs/folder"
					}
				}
			},
			"additionalProperties": false
		},
		"folderEntity": {
			"type": "object",
			"properties": {
				"viewName": {
					"type": "string",
					"description": "Entity view to bind for this entity in this folder — the name of a key under the entity definition's 'views' (column-level security), NOT a data view code from ui/data_views.json. Users in this folder then see only the columns that view lists. The conventional 'default' declares nothing and means 'no view' (full column set); any other name that the entity does not declare fails the install."
				},
				"quickAdd": {
					"type": "boolean",
					"description": "Enable the quick-add (+) button for this entity in this folder"
				},
				"rowFilter": {
					"description": "Row-level filter. Either a SQL expression string (e.g. \"is_customer = true\") or a canonical filter object (`{c,o,v}` for one condition, `{g,i:[]}` for a group).",
					"oneOf": [
						{ "type": "string" },
						{ "$ref": "#/$defs/filter" }
					]
				}
			},
			"additionalProperties": false
		},

		"filter": {
			"description": "Canonical dForge filter expression — same shape as in data_views.json. Either `{c, o, v}` or `{g, i: [...]}`.",
			"oneOf": [
				{ "$ref": "#/$defs/filterCondition" },
				{ "$ref": "#/$defs/filterGroup" }
			]
		},
		"filterCondition": {
			"type": "object",
			"required": ["c", "o"],
			"properties": {
				"c": { "type": "string" },
				"o": {
					"type": "string",
					"enum": [
						"=", "eq", "!=", "notEq",
						">", "gr", ">=", "grEq", "<", "less", "<=", "lessEq",
						"eqRef",
						"contains", "!contains", "nContain",
						"start", "!start", "nStart",
						"end", "!end", "nEnd",
						"mask", "!mask", "nMask",
						"null", "empty", "!null", "nEmpty",
						"in", "!in", "nIn",
						"between", "btw", "!between", "nBetween",
						"f", "func"
					],
					"description": "Operator — same closed set as data_views.json. Null checks are 'null' / '!null' (NOT 'isNull' / 'isNotNull'); substring matching is 'contains' (NOT 'like'). An operator outside this set is rejected at install; at query time it would be dropped, widening the row filter it was meant to enforce."
				},
				"v": {}
			},
			"additionalProperties": false
		},
		"filterGroup": {
			"type": "object",
			"required": ["g", "i"],
			"properties": {
				"g": { "type": "string", "enum": ["and", "or", "!and", "nAnd", "!or", "nOr"] },
				"i": {
					"type": "array",
					"items": { "$ref": "#/$defs/filter" }
				}
			},
			"additionalProperties": false
		}
	}
}
